{
  "module": "app_env_sensor",
  "file": "docs/flow/app_env_sensor_flow.md",
  "graph_type": "flowchart",
  "base_version": null,
  "current_version": "1.1",
  "status": "approved",
  "nodes": {
    "total": 15,
    "added": [],
    "removed": [],
    "renamed": []
  },
  "edges": {
    "total": 18,
    "added": [],
    "removed": [],
    "modified": []
  },
  "change_count": 0,
  "change_ratio": 0.0,
  "generation_mode": "skip",
  "baseline_source": null,
  "change_summary": "流程图与上轮一致，跳过代码生成",
  "updated_at": "2026-09-29T18:13:30"
}