{
  "module": "app_uart_report",
  "file": "docs/flow/app_uart_report_sequence.md",
  "graph_type": "sequenceDiagram",
  "base_version": null,
  "current_version": "1.0",
  "status": "approved",
  "nodes": {
    "total": 2,
    "added": [],
    "removed": [],
    "renamed": []
  },
  "edges": {
    "total": 7,
    "added": [],
    "removed": [],
    "modified": []
  },
  "change_count": 0,
  "change_ratio": 0.0,
  "generation_mode": "skip",
  "baseline_source": null,
  "change_summary": "流程图与上轮一致，跳过代码生成",
  "updated_at": "2026-09-29T18:13:30"
}